{
  "$schema": "https://json-schema.org/draft/2020-12/schema",
  "$id": "https://momo-fdvs.local/contracts/transaction-deduplication-manifest-v1.schema.json",
  "title": "MoMo-FDVS safe exact-row deduplication manifest",
  "type": "object",
  "additionalProperties": false,
  "required": ["schema_version", "transformation_version", "dataset_id", "source_dataset_version", "derived_dataset_version", "created_at", "source_sha256", "source_size_bytes", "output_sha256", "output_size_bytes", "header_sha256", "source_row_count", "output_row_count", "removed_duplicate_row_count", "duplicate_group_count", "max_duplicate_group_size", "source_positive_count", "output_positive_count", "removed_positive_count", "preserved_row_policy", "source_bytes_modified", "output_bytes_committed", "network_acquisition_executed", "splits_created", "training_executed", "promotable_for_training"],
  "properties": {
    "schema_version": {"const": "transaction-deduplication-manifest-v1"},
    "transformation_version": {"const": "exact-row-first-occurrence-v1"},
    "dataset_id": {"type": "string", "minLength": 1},
    "source_dataset_version": {"type": "string", "minLength": 1},
    "derived_dataset_version": {"type": "string", "minLength": 1},
    "created_at": {"type": "string", "format": "date-time"},
    "source_sha256": {"type": "string", "pattern": "^[0-9a-f]{64}$"},
    "source_size_bytes": {"type": "integer", "minimum": 1},
    "output_sha256": {"type": "string", "pattern": "^[0-9a-f]{64}$"},
    "output_size_bytes": {"type": "integer", "minimum": 1},
    "header_sha256": {"type": "string", "pattern": "^[0-9a-f]{64}$"},
    "source_row_count": {"type": "integer", "minimum": 1},
    "output_row_count": {"type": "integer", "minimum": 1},
    "removed_duplicate_row_count": {"type": "integer", "minimum": 1},
    "duplicate_group_count": {"type": "integer", "minimum": 1},
    "max_duplicate_group_size": {"type": "integer", "minimum": 2},
    "source_positive_count": {"type": "integer", "minimum": 1},
    "output_positive_count": {"type": "integer", "minimum": 1},
    "removed_positive_count": {"type": "integer", "minimum": 0},
    "preserved_row_policy": {"const": "first_occurrence_in_source_order"},
    "source_bytes_modified": {"const": false},
    "output_bytes_committed": {"const": false},
    "network_acquisition_executed": {"const": false},
    "splits_created": {"const": false},
    "training_executed": {"const": false},
    "promotable_for_training": {"const": false}
  }
}
