{
  "created_at": "2026-08-11T08:00:00Z",
  "dataset_id": "momtsim-v2",
  "derived_dataset_version": "2-derived-exact-dedup-v1",
  "duplicate_group_count": 20,
  "header_sha256": "e527e0821a72dda50c06d160e8067788d282f5c69c0310f89314772f871c61d5",
  "max_duplicate_group_size": 2,
  "network_acquisition_executed": false,
  "output_bytes_committed": false,
  "output_positive_count": 2233118,
  "output_row_count": 4225938,
  "output_sha256": "642fcb2ba7c9cbfffb933729d118f426fefddcbaabbf002793807be169fe80cd",
  "output_size_bytes": 366396355,
  "preserved_row_policy": "first_occurrence_in_source_order",
  "promotable_for_training": false,
  "removed_duplicate_row_count": 20,
  "removed_positive_count": 0,
  "schema_version": "transaction-deduplication-manifest-v1",
  "source_bytes_modified": false,
  "source_dataset_version": "2",
  "source_positive_count": 2233118,
  "source_row_count": 4225958,
  "source_sha256": "99fd07c3a9d3c4bd6d3462240058ca19d0d9e9284683f78bf77542ff7fcc05e7",
  "source_size_bytes": 366397921,
  "splits_created": false,
  "training_executed": false,
  "transformation_version": "exact-row-first-occurrence-v1"
}
